text,labels
ถ้าไม่เจอเหตุการณ์แบบนี้ ประเทศไทยคงไม่ปราบยาเสพติดนี้ได้แย่จริงๆๆตำรวจไทย,neg
ฉันไม่อยากทำงานแล้วฉันเหนื่อยฉันเพลีย,neg
ใครที่ชอบซูชิ แนะนำครับ ถูก ดี อร่อย,pos
กินข้าวหน้าแซลมอนแบบไม่จิ้มเลย แปลว่าทางร้านปรุงรสในข้าวแล้ว ยิ่งอยากลองเลย,pos
ชอบพี่แกมาก เป็นกำลังใจให้ทำต่อไปเรื่อยๆอย่าอยุดเลยนะครบ ,pos
99บาทคุ้มค่า​มาก​สุดยอด​จริงๆ​เจ้มจ้น​แน่นอน​ขอบคุณ​เจ้าของ​ร้านจากใจจริง​,pos
พี่พีช​แนะนำ​เมนู​แต่ละ​ร้าน​ได้​น่าสนใจ​มาก​ครับ​สุดยอด​จริงๆ​ดู​แล้ว​ดี​ต่อ​ใจ​มาก​เลิฟยู​,pos
ราคาคุ้มค่าสุดๆ ขอให้ร้านขายดีๆครับ ถ้ามีโอกาสอยากไปลองมั่ง,pos
ถูกจริง จัดหนัก จัดเต็มได้สบายๆเลย น่ากิน น่าลอง ถูกใจ สาย ซูชิ มากครับ ,pos
คุ้มมากคับน่ากินมากๆ,pos
อยากมีร้านดีๆแบบนี้ คุ้มๆ อยู่ใกล้บ้านจัง,pos
กินได้อร่อยทุกอย่างเลยค่ะ,pos
เฮ้ย มันลงตัวมาก และสนุกมาก แถมมีทั้งสาระ,pos
ร้านนี้เคยไปกิน อิ่มมากกกกกกก อร่อยดีนะ เนื้อหลากหลายดี สายเนื้อน่าจะชอบ,pos
ดูแล้วหิวเลย น่าทานมากๆ ต้องตามรอยไปทานซะแล้ว,pos
น่ากินมากค่าาา ไม่เคยกินอาหารบลาซิลอาเจนเลยค่ะ,pos
อยากไปมากกกก มีชิมิชูริ คิดถึงอาหารอาร์เจน,pos
อื้อหืมมมม สวรรค์ของคนรักเนื้อจริงๆ ,pos
ร้านนี้คือแบบน่าสน ไม่รู้ ไม่สนราคา แต่ว่าไม่จำกัดเวลานี่ ชอบมว้ากกกก,pos
น่ากินจังเลย เดี๋ยวต้องหาโอกาสไปกินบ้างแล้ว,pos
อยากไปร้านนี้มากเลยบุฟเฟ่ต์ไม่จำกัดเวลา ของก็น่ากินมาก หิว,pos
ร้านนี้อร่อยจริงค่ะ เมื่อก่อนทานบ่อยมากคุ้มค่าค่ะ,pos
น่าทานมากค่าาาา ต้องไปตามแล้วววว,pos
ขอบคุณที่ทำให้มาม่าผมอร่อยขึ้นนะค้าบบบบบ,pos
ฉ่ำๆเลยครับ น่ากินทุกเเมนู,pos
ได้ประโยชน์มากๆครับ,pos
โคตรเท่คนนี้,pos
ก๋วยเตี๋ยวน่าทานมาก น้ำซุปเข้มข้น ,pos
ได้ทั้งบุญ ได้ทั้งอิ่ม สุขกายสบายใจ สุขภาพแข็งแรงครับ,pos
อยากกินก๊วยเตี๋ยวน้ำตก น้ำข้นๆแบบนี้เลยค่ะ น่ากินมาก หิวเลย,pos
อยากลองชิมบ้างจังเลย,pos
กินได้น่าอร่อยมากครับ หิวตามมม,pos
ขอบคุณค่ะที่ทำเพื่อชาติเพื่อประชาชน,pos
อากาศเย็นๆ เดินเล่นกินของอุ่นๆ ฟินมากเลยง้าบ,pos
เพิ่งไปมาเมื่อปลายปีที่แล้ว คิดถึง เป็นสถานที่ท่องเที่ยวที่อากาศดี อาหารอร่อยจริงค่ะ,pos
เป็น​หมู่บ้าน​ที่​สวยงาม​และ​สงบ​ แถม​อากาศ​ดีมากๆ​ ,pos
กลับมาดูบ่อยๆ ชอบดูตอนทำงาน เปิดทิ้งไว้ เหมือนมีเพื่อนมาพูดข้างๆ,pos
2 ปีแล้ว ยังน่ารักเหมือนเดิมเลยค่ะ แงงงงหมดโควิดไปเที่ยวอีกเยอะๆเลยน้า,pos
ทำไมกล้องเธอมันดูดีจังฟะ,pos
วนกลับมาดูกี่รอบๆก็ชอบตลอดเลย เพลินมากกกกก ,pos
พาเที่ยวอีกแล้ว​ ดูละรู้สึก​ได้ไปเที่ยวด้วยเลยอะ,pos
ดูแล้วอยากไปเที่ยวเกาหลีเยย,pos
ชอบจังค่ะ รู้สึกฟินกับเกาหลี เพราะอากาศบ้านเค้าคือดีย์,pos
"ตลกตากล้อง ตอนวิ่งกลัวตกเครื่อง มีอารมณ์แบบว่า ""อปป้าหล่อมาก",pos
กลับมาดูอีกรอบก็ไม่เบื่อ ชอบทริปไปเที่ยวของพี่เมมากกก,pos
ขำหน่องตบมุกกับตากล้องงงง ทั้งขำทั้งเอ็นดู รักกกกก ,pos
โอ้ยนย สวยมากดูเพลินมากจริงๆ,pos
อุดรน่าไปเที่ยวมากๆเลยค่า,pos
สามคนนี้อยู่ด้วยกันแล้วสนุกอะ55555555,pos
ไปครั้งเดียว เที่ยวจุใจเว่อร์ ,pos
ชอบเวลาที่ทำอาหาร และกิน มีเสน่ห์และชวนกินมากก,pos
อิตาลีมาแล้ววว สวยทั้งคนทั้งเมืองเล้ย ,pos
นิสสันนาวารา เอกลักษณ์เฉพาะตัวไม่เหมือนใครสนใจทดลองขับโชว์รูมใกล้บ้าน,pos
แต่ละเมนู​น่าโดนมากๆๆๆ,pos
อยากฟังข่าวดีคราบบ สู้ๆนะครับทุกท่าน,pos
น่ารักมากๆ จะเอาแบบนี้,pos
ขอบคุณมากค๊าา..เดี๋ยวไปทานแล้วจะถ่ายรูปสวยๆมาให้นะคะ,pos
ก้อนดีใจด้วยนะฮ่าบบบ,pos
จริงอันนี้เข้าตาสุดๆ อยากดั้ย,pos
อยากให้คริปยาวๆสัก30นาทีกว่าๆ ชอบแนวนี้มาก เที่ยวเยอะๆนะ,pos
สวดดดยอดด โครตดี,pos
ดูท่าน่าสนุกก,pos
ชอบเวลาพี่ทำคลิปงี้ มันจะน่าดูยิ่งขึ้น,pos
พี่ๆ​ทำ​คอนเทนต์​อะไร​ก็​น่าสนใจ​ไปหมด​ดู​แล้ว​เพลิดเพลิน​จริง,pos
คู่สุดท้ายยิ้มแก้มปริเลย,pos
เอาจริงนะ ดูรายการนี้สนุกมากๆ คนดูยังเขินขนาดนี้เลยนะเนี่ย แต่น่ารักทุกคนเลย ชอบรายการนี้มากๆค่,pos
น่ารักกันมากเลย เขินไปหมดแร้วนะค่ะ,pos
ต้องมาแล้ว รับประกันความฮา มากกว่าเขินแน่นอน,pos
ชอบคนสุดท้ายมากๆ ดูไปเขินไป,pos
อร่อยไม่เชื่อมาดูช่องผมได้,pos
กินเร็วกินเยอะสุดยอดมาก,pos
เห็นกินละหิวเลย น่ากินอะ,pos
น่ารักกันทั้งคู่,pos
แต่ละคนอย่างฮา ,pos
ตั้งแต่มีทีมงานฮ่าๆคือสนุกมากกก ชอบคลิปแนวนี้มาก,pos
ชอบคริปเเนวนี้มากครับสนุกมากๆ,pos
ขับได้เท่มาก ติดตามเป็นแฟนคลับ,pos
สุดจัด เต็มระบบไปเลย เป็นศึกชิงความเร็ว ที่สนุกสนานดีครับพี่ๆ,pos
ตัวจริงอย่างหล่อเลยครับ,pos
อินมากก ฟังและดูหลายรอบ ,pos
นางเอกน่ารักก,pos
เพลงดีอ่า นางเอกน่ารักมั่กกก ใจละลาย,pos
ดีมากเลย เข้าถึงอารมณ์ ถึงใจสุดๆ,pos
ชอบมากกก,pos
ชอบมากกกกก ฟังเบื้องหลังเพลินๆ สนุกมากๆ บรรยากาศมาเต็ม ขออีกๆครับ,pos
เป็นรายการผีที่ไม่มีความน่ากลัว แมร่งมีแต่ความฮา ,pos
ขออีกครับพี่สนุกดีครับขอหลายๆคลิปเลยนะครับ,pos
ยังฮาและสนุกเหมือนเดิมเลย,pos
ชอบการเล่าเรื่องครับ สนุก ทำให้เรื่องราวดูไม่น่าเบื่อ,pos
ดูการพูดก็รู้ว่า ฉลาดมาก จำได้ไง เกือบทุกเรื่อง ไ,pos
เล่าได้เพลิดเพลินและมีสาระดีมาก..ทำคลิปเยอะๆนะ,pos
ผมชอบเลย ดูมา3-4คลิปละ การเล่าเรื่อง สั้นๆแต่ได้ใจความ,pos
ชอบพี่เล่าเรื่องอ่ะ พอฟังเสร็จล่ะเอาไปโม้ให้เพื่อนฟังต่อได้,pos
น่ารักเวอร์น่ารักเวอร์,pos
"อธิบาย เล่า และถ่ายทอด"" ใช้ภาษา""ได้เข้าใจได้ง่าย ชอบมาก เป็นกำลังใจครับ",pos
ฟังแล้วเพลินดีครับ ขอบคุณสำหรับสาระดีๆแบบนี้นะครับ,pos
พี่เล่าได้เข้าใจง่ายๆ เหมือนเพื่อนเม้าส์ให้ฟัง แต่มีสาระครบถ้วน สู้ๆครับ,pos
เล่าเรื่องอะไรก็น่าฟังไปหมดเลยค่ะ,pos
หนูชอบดูช่องพี่มากค่ะ เพราะตัวหนูก็ชอบประวัติ&สังคมด้วยค่ะ ขอความรู้เยอะๆนะค,pos
ชื่นชมมากค่ะ คลิปนี้ทำออกมาดีมากเลย สนุก ได้ความรู้ ฟังไม่เบื่อเลย ,pos
ชอบความเล่าเรื่อง กระชับ เเน่น เข้าใจง่ายมาก ติดตามครับ ไล่ดูทุกคลิป,pos
รักแล้วอ่ะค่ะช่องนี้ ฟังแล้วได้ความรู้มาโดยตลอดเลยค่ะ ,pos
แม่งโครตไม่ดี,neg
ไม่ดี,neg
ต่ำช้าเลวทราม,neg
นิสัยโรคจิต วิปริตมากๆรับไม่ได้,neg
ทรงดีไม่พอ,neg
ทำไมพระบ้านเรา ทำให้หมดศรัทธาจังคะ,neg
น่าสงสาร ท่าน มากๆ กรรมจะแสดงผลชาตินี้ และ ภพหน้า ,neg
เรื่องแบบนี้ ไม่ควรเกิดขึ้น กับพระสงฆ์ ถ้าตัดทางโลกไม่ได้ก็ไม่ควรจะทำแบบนี้,neg
เวรกรรม​แท้​ๆ​ตัดกิเลสไม่ได้ก็สึกเถอะ,neg
ซื้อแต่ผ้าอนามัยแบบเย็นมาค่ะ แบบว่าอีห่ากูนอนไม่ได้,neg
การด่าไปเหมือนได้บรรเทาความเครียดเฉยๆ แต่บีทีเอส (รถไฟฟ้า) มันสำนึกมั้ย ก็ไม่อ่ะ,neg
ไอเหี้ยพวกเหี้ยถ้าไม่ได้ภาษีแม่งจับหมดไอสัส นายกก้นิ่งไม่มองดูประชาชนเลย,neg
ภาคเหนือไม่ค่อยมีสาขาเลย สองมาตรฐานมาก!! เพิ่มสาขาหน่อยสิครับ,neg
ฝ้ายจะไม่ทน กับคนนิสัยไม่ดี,neg
โดนผีสิงห์ .. ลุกมะไหวเบยยย ,neg
แอร์เอเชียได้เงินกูครั้งเดียวพอ จำไว้,neg
เฮ้อออ,neg
แต่คนปฎิบัติไม่ถึงเอง ,neg
ด่าไปก็โดนบล็อก อาชีพนี้ดีจิงๆน่าสนใจ ต้นทุนไม่มีแดกฟรีทุกงาน,neg
ศาสนา ไม่เคยเสื่อม มีแต่คน บางคน เท่านั้นที่ ทำให้ศาสนาเสื่อม,neg
บ้านเราทําใหมมันมีแต่สิ่งไม่ดีเกิดขึ้นมากเลย,neg
คนไทยก็เอือมระอากับพฤติกรรมของตำรวจไทย,neg
หมดคำจะพูดกับตำรวจไทย แค่ทำร้ายคนในประเทศก็แย่แล้ว ,neg
ยังทำให้ประเทศชาติเสื่อมเสียชื่อเสียงไม่เว้นแต่ละวัน,neg
สังคมในวัด ก็เป็นชะแบบนี้ รู้ทั้งรู้ แต่ รักษาและปกปิด ความเลว ใว้,neg
พวกที่บวชมาเพื่อผลประโยชน์..กรรมมันแรงนะครับ..ทั้งชาตินี้และชาติหน้า,neg
วงการนี้แย่ทุกองค์ .,neg
ถ้าผิดก็สึกเถอะบาปจะได้น้อยลง แต่ก็ยังบาปอยู่ดี ทำอะไรไว้ก็รับเอาไปยาวๆละกัน,neg
แก่จะตายห่ายังทำเรื่องเชี่ยๆแบบนี้อีก.ผ้าม่านก็ใช่เลย,neg
ไม่แผ่วจริงๆ วงการนี้ หลังกุฏิ มีอะไรมากกว่าที่โยมคิด,neg
มันป็นวิบากกรรมที่ต้องมาชดใช้,neg
อุจาดที่สุด,neg
ถ้าท่านทำจริง เวรกรรมจะตามท่าน ไปตลอดชีวิต,neg
จับได้ขนาดนั้นแล้วบอกไม่ใช่ตัวเอง สึกเถอะ พูดโกหก,neg
รู้สึกแย่มากๆ....ขอเถอะค่ะ...อย่าให้เสื่อมเสียมากไปกว่านี้เลย.,neg
พวกข้าราชการทำผิดควรโดนปลดออกจากราชการให้เข็ด,neg
โจรในคราบตำรวจ มันอันตรายจริงๆ,neg
ทุกคนคงเบื่อกับบทลงโทษที่ตร.คนนี้จะได้รับ,neg
นี้มันโจรชัดๆ ทำแบบไม่เกรงกลัวกฎหมายด้วย ทำไมไม่สั่งขังใว้ก่อน,neg
ทุกวันนี้แยกไม่ออกเลย อันไหนเรียกตะกวด อันไหนเรียกตำรวจ,neg
ไล่ออกยังไม่พอ ต้องดำเนินคดีเข้าคุกนะ กฏหมายอ่อนๆ,neg
ไล่ออกไม่พอ ต้องลงโทษ เอาเข้าคุกไปเลย,neg
เสียดายเงินภาษีที่ให้พวกนี้,neg
ไม่ต้องรักษาหรอก..พวกแบบนี้ปล่อยให้ตาย.,neg
มนุษย์ทุกวันนี้ทำตัวเยี่ยงเดรัจฉาน น่าอับอายสุดๆ,neg
ยุคนี้คนกำลังจะกลายเป็นสัตว์สมสู่กันไม่เลือกที่!เวรกรรมน่าสมเพศ,neg
ป่วยยังไม่มีจิตรสำนึก,neg
ห่างวัดห่างวา..สำนึกผิดชั่วไม่มี..เป็นเดรัชฉานที่มาในรูปกายของมนุษย์,neg
เอามันไปทิ้งไม่ต้องรักษาไป้,neg
เลวมาก​ เค้าให้พวกคุณ​รักษาตัว​ แต่เอาโอกาสนี้ทำเรื่องน่าอับอาย,neg
หน้าที่พลเมือง ของคนใน ป. นี้ตกต่ำลงทุกวันเลยเนาะ หน้าเศร้าจริงๆๆ,neg
เกลียด ชอบหลอกให้สั่งซื้อ ที่ไหนได้ไม่มีสิ้นค้า,neg
สินค้าด้อยคุณภาพ      ,neg
สินค้าหมดทำไมไม่แจ้งขึ้นว่าหมดอะ.กดใส่ตะกร้าไปเถอะ.เซ็งเรย     ,neg
อย่าทำแบบนี้กับใครอีกนะค่ะแย่มากค่ะ    ,neg
คือเเบบผิดหวังมาก เเย่ที่สุดได้ของมาฝาเเตก เเตกนิดหน่อยไม่ว่าเเตกเยอะมาก ครั้งเดียวพอจบเเยก,neg
ส่งช้าจัง รอนานมาก ยกเลิกก้อไม่ได้   ,neg
แย่มากกกกกกค่ะ เอาของพังมาให้ฉุนมาดค่ะไม่พอใจเป็นอย่างมากค่ะ. ส่งของ ก็ไม่ได้ใบเสร็จ. ไม่ไหวจะเคลียร์  ,neg
ไม่แนะนำซื้อมาใช้ได้วันเดียวใช้ไม่ได้แล้ว     ,neg
แย่ๆสั่งสินค้าไปหลายวันแล้วไม่ส่งให้สักทีเหนื่อยกับการรอคอย    ,neg
เสียความรู้สึกอย่างมาก สวยแต่ในรูปใส่ได้ครั้งเดียว ไม่ดี      ,neg
ยอดเยี่ยมค่ะ ราคาเหมาะสม บอกต่อได้เลยค่ะ       ,pos
สวยค่ะ เหมือนในรูปเลย ชอบค่ะ ส่งของไวมากก      ,pos
ใช้ดีค่ะหน้านุ่มและขาวขึ้น    ,pos
จัดส่งเร็วมาก สะดวกดี ของจริงขนาดใหญ่กว่าที่คิดไว้ แต่ใช้งานได้ดี     ,pos
ชอบสินค้ามาก ไม่ผิดหวังที่รอ สวยยังบรรจุภัณฑ์คับ      ,pos
สินค้าส่งรวดเร็ว พอใจในสินค้าครับ     ,pos
สินค้าคุณภาพดี แข็งแรง เสียงดี เด็กๆ ชอบ และยังส่งเร็วด้วยค่ะ  ,pos
ราคากับคุณภาพของสินค้ามีความเหมาะสม ใช้งานง่าย  ,pos
ส่งของไว ห่อพัสดุดี  ของใช้งานเยี่ยม   ,pos
สวยค่ะ การจัดส่งก็รวดเร็วดีค่ะ  ,pos
ใช้เดือนเดียวพังแย่ๆมากๆ      ,neg
เสียใจความรู้สึกมากกระเป๋าบางมากไม่ตรงกะแบบสินค้าที่ลงการแพ็คของส่งก็แย่เอาถุงดำที่ใส่ขยะแถมสกปรกมากทำไมไม่ตรวจสอบก่อนส่งถึงมือลูกค้าเราไปซื้อของคุณนะไม่ได้ไปขอฟรีๆปรับปรุงด่วน!!!!   ,neg
การส่งของแย่มาก ขนาดตะโกนว่ารอเดี๋ยว ยังโยนสินค้าข้ามรั้ว ถ้าโน้ตบุคเสียหายจะทำยังไง    ,neg
ใช้ในรถระบบเสีย พังใช้ต่อไม่ได้ ,neg
ผิดหวัง ลบไม่ออก        ,neg
หมดอายุแล้วไม่ควรเอามาลงขายค่ะเสียใจผิดหวังมากๆค่ะกว่าจะหมดแพงด้วยนะ   ,neg
ส่งช้ามาก ตอนนี้ยังไม่ได้ของ   ,neg
ได้รับของแล้วผิดหวังมาก ไม่ดีเลยค่ะ    ,neg
สินค้าไม่มีคุณภาพสายกางเกงไม่เท่ากัน    ,neg
ช้าสุดๆรอจนรำคาญละ     ,neg
คุณภาพคุ้มค่าครับ      ,neg
ส่งเร็วดี ใช้ดีคุ้มมาก ราคาถูก  ,pos
ได้รับสินค้าเร็วค่ะ และสินค้าก็มีคุณภาพ สวมใส่สบายตัวมากๆๆ เลยค่ะ       ,pos
ได้รับของเร็วมาก.. แถมสินค้าได้ตามต้องการสวยมาก ,pos
รับประทานดีอยู่นะครับ มองเห็นความเปลี่ยนแปลงของร่างกาย ทานแล้วรู้สึกว่าดีนะ     ,pos
ใช้ได้ดีเหมาะกับราคานี้ ก็สรุปว่าดีครับ ,pos
