text,labels
"มากินเนื้อกันเถอะ เนื้อ ""แว่นสะโพก"" รู้จักกันป่ะ อร่อยมากเป็นส่วนเล็กๆ ที่แปะอยู่กับสะโพก มี 2 ชิ้นต่อตัว เนื้อนุ่ม ไขมันแทรก เอาลงกระทะไม่ต้องใส่เนย เดี๋ยวไขมันจะละลายออกมาเอง โรยเกลือ โรยพริกไทย จะจิ้มน้ำจิ้มแจ่วด้วยก็ได้ อร่อยที่สุด😉 อยากอวด เนื้ออร่อย เนื้อ KU Beef นะจ๊ะ😁",pos
ขอบคุณค้า,pos
คนอะไรใจร้ายเหมือนหน้าตา,pos
ซื้อแล้วผิดหวังสินค้าไม่มีคุณภาพ        ,pos
แย่มาก บิดน้ำไม่แห้ง เสียดายตังมาก      ,pos
ตกใจมาก โคตรแย่ ก่อนหน้านี้ใช้ดี ชอบมาก ปลอดภัยดี ตอนระเบิดมีกลิ่นไหม้กับประกายไฟ ไม่เป็นแผลแต่เป็นดำๆ ที่มือ แสบเล็กน้อย       ,pos
สินค้าใช้ดีสีสดใช้จนถึงทุกวันนี้        ,pos
ร้านนี้ ขายสินค้าตรงตามประกาศ ส่งตามกำหนด สินค้าใช้งานดี        ,pos
ถูกกว่าในห้างเยอะเลยครับ ภาพชัด สินค้าใหม่ พนักงานบริการดีมาก สั่งสินค้ากับลาซาด้าไม่เคยผิดหวังเลยครับ  ,pos
แรงดี หน้าจอใหญ่ ส่งของเร็ว พอใจครับ    ,pos
จอใหญ่มาก คุณภาพเสียง ชัดเจนดีมาก โดยรวมแล้วคุ้มค่ามาก  ,pos
พกพาสะดวก ได้ของเร็ว    ,pos
โอเคมาก เป็นอย่างที่คาดหวังไว้ เยี่ยม   ,pos
ได้สินค้าภายในสองวัน OK นะครับ สมราคา ใช้งานได้ปกติ     ,pos
ดีมากๆๆคะ ได้เร็ว แพ๊คดี สินค้าสภาพดี ราคาถูก ไม่ต้องไปเดินช๊อปเอง ดีคะ ,pos
ส่งของรวดเร็วมาก สินค้าใหม่ด้วย โดยรวมให้คะแนนเต็มครับ  ,pos
อิ่มจังที่...@hotpot โฮมราชบุรีคร้าาาา,pos
ทางหัวหน้างานได้โทรมาแล้วนะคะ ขอบคุณที่ทางMK ใส่ใจในปัญหาของลูกค้าและพร้อมจะรับผิดชอบและแก้ไขไปในทางที่ดีขึ้นค่ะ,pos
ผมรักเม้นนี้ ชัดเจน ทราบแล้วเปลี่ยน,pos
เมนูฮิตที่ทุกคนคนชอบ,pos
ดื่มง่าย ดื่มคล่อง ไม่ต้องบีบจมูกเวลาดื่มด้วยจ้า จะไปซื้อกันยังนะ,pos
ไปเลยกำลังว่าง,pos
ส่งเร็วดี ใช้ดีคุ้มมาก ราคาถูก  ,pos
ได้รับสินค้าเร็วค่ะ และสินค้าก็มีคุณภาพ สวมใส่สบายตัวมากๆๆ เลยค่ะ       ,pos
ได้รับของเร็วมาก.. แถมสินค้าได้ตามต้องการสวยมาก ,pos
รับประทานดีอยู่นะครับ มองเห็นความเปลี่ยนแปลงของร่างกาย ทานแล้วรู้สึกว่าดีนะ     ,pos
ใช้ได้ดีเหมาะกับราคานี้ ก็สรุปว่าดีครับ ,pos
สินค้าใช้แล้วดีมากไม่ทำให้ลูกแพ้เลยแถมราคาถูกกว่าในห้างและตามร้านค้าอีก ,pos
ใช้งานดีมากส่งของก็เร็วของครับ  ,pos
ส่งไวมาก สั่งตอนเย็น ตอนเช้าได้แล้ว สินค้าแพ็คมาดีมาก ใช้งานได้ปกติไม่มีปัญหาอะไร ถือว่าคุ้มค่าสุดๆครับ ,pos
วัสดุค่อนข้างดีนับว่าคุ้มราคาครับ       ,pos
ใส่สบายสั่งหลายรอบแล้วจร้าาา    ,pos
ส่งของรวดเร็วดี คุณภาพใช้ได้ค่ะ ,pos
ใช้งานได้ดีราคาไม่แพงมาก       ,pos
ชอบที่ส่งเร็วมากครับ ทันใจดีจิงๆ        ,pos
รับของไว พนักงานส่งของดีมาก คุณภาพคุ้มราคา      ,pos
ดีครับ คุ้มค่าคุ้มราคา น่าจะใช้งานได้ทนทานมือใหม่น่าเอามาใช้ครับ      ,pos
คุณภาพพอใช้ได้  ดูบอบบางจัง ต้องดูระยะการใช้งานระยะยาวค่ะรวม ๆ ถือว่าโอเคค่ะ    ,pos
สินค้าแพคอย่างดี ที่สำคัญส่งขอเร็วมาก คิดว่าจะได้ช้าเสียอีก     ,pos
ส่งของไวมาก แต่ราคาขึ้นลงบ่อยมา ต้องเข้ามาเช็คราคาบ่อยๆ ว่าวันไหนจะราคาถูก แต่คุ้มแน่นอนค่ะ เลือกซื้ออันนี้ไม่ผิดหวังค่ะ        ,pos
ได้รับของเร็วมาก กระทะร้อนเร็ว ทำอาหารได้หลายอย่างเลยค่ะ ชอบมาก ,pos
เกลียด ชอบหลอกให้สั่งซื้อ ที่ไหนได้ไม่มีสิ้นค้า,neg
สินค้าด้อยคุณภาพ      ,neg
สินค้าหมดทำไมไม่แจ้งขึ้นว่าหมดอะ.กดใส่ตะกร้าไปเถอะ.เซ็งเรย     ,neg
อย่าทำแบบนี้กับใครอีกนะค่ะแย่มากค่ะ    ,neg
คือเเบบผิดหวังมาก เเย่ที่สุดได้ของมาฝาเเตก เเตกนิดหน่อยไม่ว่าเเตกเยอะมาก ครั้งเดียวพอจบเเยก,neg
ส่งช้าจัง รอนานมาก ยกเลิกก้อไม่ได้   ,neg
แย่มากกกกกกค่ะ เอาของพังมาให้ฉุนมาดค่ะไม่พอใจเป็นอย่างมากค่ะ. ส่งของ ก็ไม่ได้ใบเสร็จ. ไม่ไหวจะเคลียร์  ,neg
ไม่แนะนำซื้อมาใช้ได้วันเดียวใช้ไม่ได้แล้ว     ,neg
แย่ๆสั่งสินค้าไปหลายวันแล้วไม่ส่งให้สักทีเหนื่อยกับการรอคอย    ,neg
เสียความรู้สึกอย่างมาก สวยแต่ในรูปใส่ได้ครั้งเดียว ไม่ดี      ,neg
ใช้เดือนเดียวพังแย่ๆมากๆ      ,neg
เสียใจความรู้สึกมากกระเป๋าบางมากไม่ตรงกะแบบสินค้าที่ลงการแพ็คของส่งก็แย่เอาถุงดำที่ใส่ขยะแถมสกปรกมากทำไมไม่ตรวจสอบก่อนส่งถึงมือลูกค้าเราไปซื้อของคุณนะไม่ได้ไปขอฟรีๆปรับปรุงด่วน!!!!   ,neg
การส่งของแย่มาก ขนาดตะโกนว่ารอเดี๋ยว ยังโยนสินค้าข้ามรั้ว ถ้าโน้ตบุคเสียหายจะทำยังไง    ,neg
ใช้ในรถระบบเสีย พังใช้ต่อไม่ได้ ,neg
ผิดหวัง ลบไม่ออก        ,neg
หมดอายุแล้วไม่ควรเอามาลงขายค่ะเสียใจผิดหวังมากๆค่ะกว่าจะหมดแพงด้วยนะ   ,neg
ส่งช้ามาก ตอนนี้ยังไม่ได้ของ   ,neg
ได้รับของแล้วผิดหวังมาก ไม่ดีเลยค่ะ    ,neg
สินค้าไม่มีคุณภาพสายกางเกงไม่เท่ากัน    ,neg
ช้าสุดๆรอจนรำคาญละ     ,neg
คุณภาพคุ้มค่าครับ      ,neg
เสียใจความรู้สึกมากกระเป๋าบางมากไม่ตรงกะแบบสินค้าที่ลงการแพ็คของส่งก็แย่เอาถุงดำที่ใส่ขยะแถมสกปรกมากทำไมไม่ตรวจสอบก่อนส่งถึงมือลูกค้าเราไปซื้อของคุณนะไม่ได้ไปขอฟรีๆปรับปรุงด่วน!!!!   ,neg
การส่งของแย่มาก ขนาดตะโกนว่ารอเดี๋ยว ยังโยนสินค้าข้ามรั้ว ถ้าโน้ตบุคเสียหายจะทำยังไง    ,neg
ใช้ในรถระบบเสีย พังใช้ต่อไม่ได้ ,neg
ผิดหวัง ลบไม่ออก        ,neg
หมดอายุแล้วไม่ควรเอามาลงขายค่ะเสียใจผิดหวังมากๆค่ะกว่าจะหมดแพงด้วยนะ   ,neg
ส่งช้ามาก ตอนนี้ยังไม่ได้ของ   ,neg
ได้รับของแล้วผิดหวังมาก ไม่ดีเลยค่ะ    ,neg
สินค้าไม่มีคุณภาพสายกางเกงไม่เท่ากัน    ,neg
ช้าสุดๆรอจนรำคาญละ     ,neg
คุณภาพคุ้มค่าครับ      ,neg
เขาอยากกินนนนน,pos
เมื่อวานชานมไข่มุกก็อร่อย วันนี้รุ่นพี่ก็อร่อย //สูดกาววาดไม่ทันแล้ว #เต็นสิค,pos
แวะกินเอมเค 55555,pos
น่าสน!!!ไปม๊ะ,pos
ต้องลอง555,pos
ป๊า เค้าอยากกินน,pos
ไป อยากจังแล้วนิ,pos
สมองไหลตลอด,pos
นี่นิสสันยังดูไม่ใหญ่อีกเหรอครับ..ส่วนตัวคิดว่ารถกระบะนิสันออกแบบดูเทอะทะกว่าค่ายอื่นในยุคเดียวกัน(แต่ดูตัวเลขแล้วก็ไม่ได้ใหญ่นะ)ถ้าเขาเดินเกมแบบค่ายเจ้าตลาดทั้ง2ค่ายหรือออกตัวเท่ๆแบบฟอร์ดน่าตะไปได้ดีกว่านี้(ฟอร์ดยังไม่ใข่แรปเตอร์นะแรปเตอร์ส่วนตัวว่าแรปเตอร์เป็นปิคอัพหรูน่าจะเฉพาะกลุ่มที่เงินถึงๆ),pos
เลือกได้ 2 ซุป และน้ำจิ้มท่านละ 1 รสชาติค่ะ ^^,pos
พลาดเพราะรีโว่นั่นแหละ,pos
พยามบอกเขาว่า ไอน้ำนะ ไม่ใช่ควัน,pos
งานแสงโสม,pos
14 เมษายนของทุกปี คือ วันครอบครัว ค่ะ #สวยกล้าทุกแสง #คู่หูท้าแดด #kmacosmetics,pos
รีเจนซี่ ตื่นสบายจริงเหรอ 555,pos
บุหรี่ไฟฟ้านะ ไม่ใช่ยาบ้า มึงก้บ้า เกินไป,pos
แล้วตอนนี้มึงก็แดกอะไรไม่ได้เลยอ้อ,pos
จันทร์ Shock โลก The Return คืนนี้ ดีเจโอ๊ต ปราโมทย์ เปิดบ้านต้อนรับดีเจคุณพ่อลูกหนึ่ง เจ็ม ณัฏฐ์ปวินท์ มาระเบิดความฮากับคำถามสุดช๊อกและของรางวัลสุดกวน 3-5 ทุ่มที่ EFM104.5 และชมสดพร้อมๆกันผ่าน Facebook Live & Youtube Live ลงทะเบียนเล่นเกมส์ได้แล้วตอนนี้ที่เบอร์ 02-222-2222 . สนับสนุนความ Shockkkkk โดย Centerpoint of Siam Square https://www.facebook.com/centerpointofsiamsquare BarBQ Plaza http://www.11street.co.th/store/MiniMallAction/getMiniMallHome.do?sellerHmpgUrl=barbqplaza MG http://mgcars.com/th/mg-models/mgzs/detail/overview รู้ใจดอทคอม https://www.roojai.com/ Traveloka https://www.traveloka.com/th-th/?utm_source=THFlightHotel&utm_medium=radio&utm_campaign=EOY-011117 CP https://www.facebook.com/dimsum.jadedragon/ Enchanter https://www.facebook.com/EnchanteurThailand/ #จันทร์ShockโลกTheReturn,pos
"Civic ทุกรุ่นใช้ระบบกันสะเทือนหน้าแบบคอยล์สปริง ด้านหลังทอร์ชั่นบาร์พร้อมคอยล์สปริง เครื่องยนต์ยังคงใช้รหัส D และเพิ่มรุ่นใหม่ 1,500 ซีซี CVCC โดยในปี 1984 ได้เพิ่มรุ่นแรงรหัส Si สำหรับทำตลาดญี่ปุ่น ปรับปรุงระบบกันสะเทือน และใช้เครื่องยนต์ DOHC ZC ความจุ 1,600 ซีซี กำลังสูงสุด 130 แรงม้า ส่วนรุ่นที่ทำตลาดในสหรัฐอเมริกาในชื่อ Civic Si 3 ประตู และ CRX Si ใช้เครื่องยนต์หัวฉีด 12 วาล์ว กำลังสูงสุด 91 แรงม้า เดือนพฤศจิกายน 1984 ฮอนด้าเพิ่มระบบขับเคลื่อน 4 ล้อให้ Civic เป็นครั้งแรกในรุ่น Shuttle ช่วงแรกมีปุ่มกดสำหรับเข้า-ออกจากระบบขับเคลื่อน 4 ล้อที่เรียกว่า ""Realtime"" เพราะสามารถทำได้ขณะรถวิ่ง จากนั้นในเดือนกุมภาพันธ์ 1985 จึงเพิ่มรุ่น Quint Integra ตัวถังแฮทช์แบ็ก 3 ประตู ฐานล้อ 2,450 มิลลิเมตร และในเดือนพฤศจิกายน 1986 เพิ่มรุ่น 5 ประตูแฮทช์แบค พร้อมขยายขนาดฐานล้อเป็น 2,520 มม.",pos
Nissan Note. ดาวน์เท่าไรค่ะ,pos
กลับไปจัดเลย,pos
พี่ต้าไง,pos
อะไรคือความรัก.... . เตรียมตัวให้พร้อม แล้วมาพบกับคืนนี้ Stamp (เเสตมป์ อภิวัชร์) .... . ในวันพฤหัสบดีที่ 28 ธันวาคมนี้ที่ DND Ekkamai . •Ticket : . Pre-sale ราคาเพียง 400 บาท เท่านั้น !! Front Door: 500 บาท . 🍺First 250 people who come first will get FREE BEER (a bottle of Singha light each) . ติดต่อซื้อบัตรได้ทาง Line: @untoldproject Call :088-888-8888 IG & FB: @untoldproject.bkk . #DNDDoNotDisturb #DNDBoutiquePlayhouse #ChivasExtra #Singhalight #untoldproject,pos
เขานั้นขี่ ฮอนด้าแจส มาจีบเจ้า พี่นั้งเศร้า ข้างฟีโน่ โง่เหมือนหมา ชีวิตพี่ วันวัน นั้นไปนา ส่วนแก้วตา จับปากกา ในห้องแอร์,pos
หิว อีกนิดจะขับไปซื้อแมคแล้ว ไม่ไหวแล้วโว้ย,pos
สามารถรับสิทธิ์ได้ตลอดเดือนเกิดค่ะ ^^,pos
แหะๆ,pos
สเมอร์นอฟ3ป๋องทำพิษไอสัส,pos
แต่ว่าเนื้อวัวเอ็มเคแพงนะ ต้องไปร้านที่บุฟเนื้อวัว เปาชอบ,pos
#หายไปได้พักนึง!! 🌀 กลับมาอีกแล้ว!! PM 2.5 #ก็กลับมาใช้ตัวช่วย 😷 อีกแหละ!!,pos
นี้,pos
โอเค5555,pos
#รถในฝัน! อยากได้จัดให้.. โตโยต้า ใจป้ำมอบรถในฝันโตโยต้าฟอร์จูนเนอร์รุ่นท็อปราคา 1.7 ล้านให้ศรีสะเกษ 1 คัน กำหนดมอบวันเสาร์ที่ 3 มี.ค.นี้ที่ค่ายนครหลวงโปรโมชั่น,pos
ใส่นาวาร่าราคาเท่าไหร่ครับ สแตนดาดกระด้างมาก,pos
เตาอบของก้อน มีปริมาตรสูงสุด 9 ลิตรครับ,pos
6-7 แสนให้ออกวีออส เหรอ ผมคนหนึ่ละไม่เอาแน่ เอาเงินไปซื้อ เบนซ์ E220 cdi มือ2 ปี 2004 -2008 มาขับดีกว่า ครับ,pos
พาขุนเรือง ขับ Corolla Altis ที่ดิสนีย์แลนด์,pos
กินเหล้า285 ป่าว,pos
นี่ล่ะ ที่ประชาชนต้องการ,pos
มารับ,pos
พี่เขยผมจะเอารีโว่แต่ไม่ผ่านแนน เลยเอาดีแมกแทน,pos
ขอสอบถามเซลล์โตโยต้าหน่อยครับผม Toyota Yaris รุ่น Top ตอนนี้มีส่วนลดหรือของแถมอะไรได้บ้างครับ,pos
คุณลองพกไปที่ด่านดูไหมคับ ผมจะดูว่าเค้าจะแจ้าข้อหาอะไรกับคุณ ที่คุณโฟสรูปมาผมเห็นมานานแล้วคับ ในความเป็นจริงเราเถียงเค้ายากคับ ผมเข้าใจ,pos
รอ MG6 ตัวใหม่ อย่างหรู,pos
บุรีไฟฟ้าไม่เป็นมะเร็งหราค่ะ,pos
ผมรักเม้นนี้ ชัดเจน ทราบแล้วเปลี่ยน,pos
เมนูฮิตที่ทุกคนคนชอบ,pos
ดื่มง่าย ดื่มคล่อง ไม่ต้องบีบจมูกเวลาดื่มด้วยจ้า จะไปซื้อกันยังนะ,pos
ไปเลยกำลังว่าง,pos
ส่งเร็วดี ใช้ดีคุ้มมาก ราคาถูก  ,pos
ได้รับสินค้าเร็วค่ะ และสินค้าก็มีคุณภาพ สวมใส่สบายตัวมากๆๆ เลยค่ะ       ,pos
ได้รับของเร็วมาก.. แถมสินค้าได้ตามต้องการสวยมาก ,pos
อะไรคือความรัก.... . เตรียมตัวให้พร้อม แล้วมาพบกับคืนนี้ Stamp (เเสตมป์ อภิวัชร์) .... . ในวันพฤหัสบดีที่ 28 ธันวาคมนี้ที่ DND Ekkamai . •Ticket : . Pre-sale ราคาเพียง 400 บาท เท่านั้น !! Front Door: 500 บาท . 🍺First 250 people who come first will get FREE BEER (a bottle of Singha light each) . ติดต่อซื้อบัตรได้ทาง Line: @untoldproject Call :088-888-8888 IG & FB: @untoldproject.bkk . #DNDDoNotDisturb #DNDBoutiquePlayhouse #ChivasExtra #Singhalight #untoldproject,pos
เขานั้นขี่ ฮอนด้าแจส มาจีบเจ้า พี่นั้งเศร้า ข้างฟีโน่ โง่เหมือนหมา ชีวิตพี่ วันวัน นั้นไปนา ส่วนแก้วตา จับปากกา ในห้องแอร์,pos
หิว อีกนิดจะขับไปซื้อแมคแล้ว ไม่ไหวแล้วโว้ย,pos
สามารถรับสิทธิ์ได้ตลอดเดือนเกิดค่ะ ^^,pos
แหะๆ,pos
สเมอร์นอฟ3ป๋องทำพิษไอสัส,pos
แต่ว่าเนื้อวัวเอ็มเคแพงนะ ต้องไปร้านที่บุฟเนื้อวัว เปาชอบ,pos
#หายไปได้พักนึง!! 🌀 กลับมาอีกแล้ว!! PM 2.5 #ก็กลับมาใช้ตัวช่วย 😷 อีกแหละ!!,pos
คูชั่นsephoraใช้ดีไหม ผิวมันมากกกก เบาบางไหม หารีวิวยากมาก,pos
"ตอนนี้ ก้อนขอแนะนำโปรชุด Happy Refill 399.- และ Super Refill 499.- สาขาที่ร่วมรายการ คือ เซ็นทรัลบางนาชั้น 6, อเวนิวรัชโยธิน , บิ๊กซีลำพูน, โรบินสันแม่สอด, โรบินสันนครศรีธรรมราช, โลตัสบึงกาฬ, โลตัสจันทบุรี, เทอมินอลโคราช นี้เท่านั้น และก้อนจำกัดเวลาในการรับประทาน 1.30 ชั่วโมง (ส่วนที่เกินมาทุกๆ 10 นาที คิด 20 บาทต่อท่าน) หมดเขต 31 ม.ค.61 นี้นะคร้าบ และโปรเฉพาะลูกค้าที่ทำการจองผ่านระบบออนไลน์ของ App หรือ เว็ปไซต์ Hungry Hub โดยสาขาที่ร่วมรายการ คือ สาขาเทอร์มินอล 21 และสาขาเดอะแพลทฟอร์ม วงเวียนใหญ่ เท่านั้น ครับ หมดเขต 31 ม.ค.61 นี้นะคร้าบ https://www.hungryhub.com/",pos
อืมๆ,pos
